{
  "$schema": "../../../../../tools/World/CanonicalCompilation/contracts/authored-overlay.schema.json",
  "schema_version": 2,
  "overlay_id": "manhattan_showcase_empty_overlay_v1",
  "grid_id": "grid_36784852dea14f43",
  "provenance": [],
  "terrain_patches": [],
  "feature_overrides": [],
  "missing_target_policy": "reject_and_require_rebase"
}
