{
  "$schema": "../../../../../../../tools/World/CanonicalCompilation/contracts/authored-overlay.schema.json",
  "schema_version": 2,
  "overlay_id": "synthetic_authored_overlay_v1",
  "grid_id": "grid_0daecb7b1297da7d",
  "provenance": [
    {"provenance_id": "synthetic_fixture_author", "authority": "authored_fixture"}
  ],
  "terrain_patches": [
    {"patch_id": "boundary_height_correction", "provenance_ref": "synthetic_fixture_author", "center": [0.0, 500.0], "radius_m": 250.0, "delta_m": 1.0}
  ],
  "feature_overrides": [
    {"feature_id": "alis:synthetic:way:203", "set": {"height_m": 12.0, "height_basis": "authored"}}
  ],
  "missing_target_policy": "reject_and_require_rebase"
}
